{
  "$schema": "https://json-schema.org/draft/2020-12/schema",
  "$id": "https://llm-temporal-worker.dev/schema/llm.temporal/v1/generate-response.json",
  "title": "llm.temporal/v1 GenerateResponse",
  "type": "object",
  "additionalProperties": false,
  "required": ["api_version", "operation_key", "status", "output", "route", "service", "usage", "cost", "provider", "diagnostics"],
  "properties": {
    "api_version": {"const": "llm.temporal/v1"},
    "operation_key": {"type": "string", "minLength": 1},
    "operation_id": {"type": "string"},
    "status": {"enum": ["completed", "tool_calls", "refused", "length", "content_filtered"]},
    "output": {"type": "array", "items": {"$ref": "generate-request.schema.json#/$defs/item"}},
    "route": {"$ref": "#/$defs/route"},
    "service": {"$ref": "#/$defs/service"},
    "usage": {"$ref": "#/$defs/usage"},
    "cost": {"$ref": "#/$defs/cost"},
    "provider": {"$ref": "#/$defs/provider"},
    "continuation": {"anyOf": [{"type": "null"}, {"$ref": "#/$defs/continuation"}]},
    "diagnostics": {"type": "array", "items": {"$ref": "#/$defs/diagnostic"}}
  },
  "$defs": {
    "route": {
      "type": "object",
      "additionalProperties": false,
      "properties": {
        "route_id": {"type": "string"},
        "endpoint_id": {"type": "string"},
        "api_family": {"type": "string"},
        "requested_model": {"type": "string"},
        "resolved_model": {"type": "string"}
      }
    },
    "service": {
      "type": "object",
      "additionalProperties": false,
      "required": ["requested", "attempted", "fallback_index"],
      "properties": {
        "requested": {"enum": ["economy", "standard", "priority"]},
        "attempted": {"enum": ["economy", "standard", "priority"]},
        "actual": {"enum": ["economy", "standard", "priority"]},
        "provider_value": {"type": "string"},
        "fallback_index": {"type": "integer", "minimum": 0}
      }
    },
    "usage": {
      "type": "object",
      "additionalProperties": false,
      "required": ["input_tokens", "output_tokens", "reasoning_tokens", "cache_read_tokens", "cache_write_tokens"],
      "properties": {
        "input_tokens": {"type": "integer", "minimum": 0},
        "output_tokens": {"type": "integer", "minimum": 0},
        "reasoning_tokens": {"type": "integer", "minimum": 0},
        "cache_read_tokens": {"type": "integer", "minimum": 0},
        "cache_write_tokens": {"type": "integer", "minimum": 0},
        "provider_raw": {"type": "object", "additionalProperties": true}
      }
    },
    "cost": {
      "type": "object",
      "additionalProperties": false,
      "required": ["currency", "reserved_microusd", "actual_microusd", "method", "catalog_version"],
      "properties": {
        "currency": {"type": "string"},
        "reserved_microusd": {"type": "integer", "minimum": 0},
        "actual_microusd": {"type": "integer", "minimum": 0},
        "method": {"type": "string"},
        "catalog_version": {"type": "string"}
      }
    },
    "provider": {
      "type": "object",
      "additionalProperties": false,
      "properties": {
        "response_id": {"type": "string"},
        "request_id": {"type": "string"},
        "generation_id": {"type": "string"},
        "finish_reason": {"type": "string"},
        "raw": {"type": "object", "additionalProperties": true}
      }
    },
    "continuation": {
      "type": "object",
      "additionalProperties": false,
      "required": ["handle", "pinned"],
      "properties": {
        "handle": {"type": "string"},
        "endpoint_id": {"type": "string"},
        "model": {"type": "string"},
        "expires_at": {"type": "string", "format": "date-time"},
        "pinned": {"type": "boolean"},
        "provider_state": {"type": "array"}
      }
    },
    "diagnostic": {
      "type": "object",
      "additionalProperties": false,
      "required": ["code", "severity", "message"],
      "properties": {
        "code": {"type": "string", "minLength": 1},
        "severity": {"enum": ["info", "warning", "error"]},
        "path": {"type": "string"},
        "message": {"type": "string", "minLength": 1},
        "details": {"type": "object", "additionalProperties": {"type": "string"}}
      }
    }
  }
}
