{
  "api_version": "llm.temporal/v1",
  "cost": {"actual_microusd": 0, "catalog_version": "", "currency": "", "method": "", "reserved_microusd": 0},
  "diagnostics": [],
  "operation_key": "fixture-op",
  "output": [
    {"actor": "model", "content": [{"kind": "text", "text": "hello"}], "kind": "message"}
  ],
  "provider": {
    "finish_reason": "stop",
    "raw": {"choice_index": 0},
    "request_id": "req-fixture",
    "response_id": "chat-fixture"
  },
  "route": {
    "api_family": "openai_chat",
    "endpoint_id": "chat-prod",
    "requested_model": "chat-contract",
    "resolved_model": "chat-contract"
  },
  "service": {
    "actual": "standard",
    "attempted": "standard",
    "fallback_index": 0,
    "provider_value": "default",
    "requested": "standard"
  },
  "status": "completed",
  "usage": {"cache_read_tokens": 0, "cache_write_tokens": 0, "input_tokens": 0, "output_tokens": 0, "reasoning_tokens": 0}
}
