{
  "api_version": "llm.temporal/v1",
  "operation_key": "full-1",
  "operation_id": "op-1",
  "status": "tool_calls",
  "output": [{"kind": "tool_call", "id": "call-1", "name": "lookup_invoice", "arguments": {"invoice_id": 4831}}],
  "route": {"route_id": "openai-primary", "endpoint_id": "openai-prod", "api_family": "openai_responses", "requested_model": "invoice-summarizer", "resolved_model": "gpt-example"},
  "service": {"requested": "priority", "attempted": "priority", "actual": "standard", "provider_value": "default", "fallback_index": 0},
  "usage": {"input_tokens": 612, "output_tokens": 33, "reasoning_tokens": 0, "cache_read_tokens": 0, "cache_write_tokens": 0},
  "cost": {"currency": "USD", "reserved_microusd": 41300, "actual_microusd": 7920, "method": "catalog_usage", "catalog_version": "prices-test"},
  "provider": {"response_id": "resp-1", "request_id": "req-1", "finish_reason": "tool_calls"},
  "diagnostics": [{"code": "service_class_provider_downgrade", "severity": "warning", "path": "/service/actual", "message": "Provider served standard after priority."}]
}
