{
  "api_version": "llm.temporal/v1",
  "cost": {"actual_microusd": 5, "catalog_version": "", "currency": "USD", "method": "exa_reported", "reserved_microusd": 0},
  "diagnostics": [],
  "operation_key": "fixture-usage-cost",
  "output": [
    {"actor": "model", "content": [{"kind": "text", "text": "usage response"}], "kind": "message"},
    {"kind": "reference", "metadata": {"id": "usage-result", "score": 0.8, "title": "Usage source"}, "uri": "https://example.com/usage-source"}
  ],
  "provider": {
    "finish_reason": "stop",
    "generation_id": "chat-exa-usage",
    "raw": {
      "choice_index": 0,
      "costDollars": {"total": "0.00000456"},
      "exa_cost_dollars": "0.00000456",
      "exa_results": [{"id": "usage-result", "score": 0.8, "title": "Usage source", "url": "https://example.com/usage-source"}]
    },
    "request_id": "req-exa-chat-fixture",
    "response_id": "chat-exa-usage"
  },
  "route": {
    "api_family": "openai_chat",
    "endpoint_id": "exa-chat-fixture",
    "requested_model": "exa",
    "resolved_model": "exa"
  },
  "service": {
    "actual": "standard",
    "attempted": "standard",
    "fallback_index": 0,
    "provider_value": "standard",
    "requested": "standard"
  },
  "status": "completed",
  "usage": {
    "cache_read_tokens": 5,
    "cache_write_tokens": 2,
    "input_tokens": 21,
    "output_tokens": 13,
    "provider_raw": {"costDollars": {"total": "0.00000456"}, "exa_cost_dollars": "0.00000456", "total_tokens": 34},
    "reasoning_tokens": 3
  }
}
