{
  "api_version": "llm.temporal/v1",
  "cost": {"actual_microusd": 0, "catalog_version": "", "currency": "", "method": "", "reserved_microusd": 0},
  "diagnostics": [],
  "operation_key": "fixture-openai-response",
  "output": [
    {"actor": "model", "content": [{"kind": "text", "text": "hello"}], "kind": "message"},
    {"arguments": {"q": "x"}, "id": "call-1", "kind": "tool_call", "name": "lookup"},
    {"endpoint_family": "responses", "kind": "provider_state", "media_type": "application/vnd.openai.reasoning+json", "opaque": "ewogICAgICAiaWQiOiAicmVhc29uLTEiLAogICAgICAidHlwZSI6ICJyZWFzb25pbmciLAogICAgICAic3RhdHVzIjogImNvbXBsZXRlZCIsCiAgICAgICJzdW1tYXJ5IjogW3sidHlwZSI6ICJzdW1tYXJ5X3RleHQiLCAidGV4dCI6ICJicmllZiJ9XSwKICAgICAgImNvbnRlbnQiOiBbXSwKICAgICAgImVuY3J5cHRlZF9jb250ZW50IjogbnVsbAogICAgfQ==", "provider": "openai"}
  ],
  "provider": {"finish_reason": "completed", "raw": {"output_item_ids": ["msg-1", "fc-1", "reason-1"]}, "request_id": "req-openai-fixture", "response_id": "resp-1"},
  "route": {"api_family": "openai_responses", "endpoint_id": "openai-fixture", "requested_model": "gpt-contract", "resolved_model": "gpt-contract"},
  "service": {"actual": "economy", "attempted": "priority", "fallback_index": 0, "provider_value": "flex", "requested": "priority"},
  "status": "tool_calls",
  "usage": {"cache_read_tokens": 3, "cache_write_tokens": 1, "input_tokens": 10, "output_tokens": 7, "provider_raw": {"total_tokens": 17}, "reasoning_tokens": 2}
}
