{
  "api_version": "llm.temporal/v1",
  "continuation": {"endpoint_id": "azure-fixture", "handle": "openai-responses:azure-resp-usage", "model": "azure-responses/fixture", "pinned": true, "provider_state": [{"endpoint_family": "responses", "kind": "provider_state", "media_type": "application/vnd.openai.response+json", "opaque": "YXp1cmUtcmVzcC11c2FnZQ==", "provider": "openai"}]},
  "cost": {"actual_microusd": 0, "catalog_version": "", "currency": "", "method": "", "reserved_microusd": 0},
  "diagnostics": [],
  "operation_key": "fixture-usage-cost",
  "output": [],
  "provider": {"finish_reason": "completed", "request_id": "req-azure-fixture", "response_id": "azure-resp-usage"},
  "route": {"api_family": "openai_responses", "endpoint_id": "azure-fixture", "requested_model": "azure-responses/fixture", "resolved_model": "azure-responses/fixture"},
  "service": {"actual": "standard", "attempted": "standard", "fallback_index": 0, "provider_value": "default", "requested": "standard"},
  "status": "completed",
  "usage": {"cache_read_tokens": 7, "cache_write_tokens": 2, "input_tokens": 31, "output_tokens": 17, "provider_raw": {"total_tokens": 48}, "reasoning_tokens": 4}
}
