{
  "api_version": "llm.temporal/v1",
  "cost": {"actual_microusd": 0, "catalog_version": "", "currency": "", "method": "", "reserved_microusd": 0},
  "diagnostics": [],
  "operation_key": "fixture-bedrock-full-stream",
  "output": [
    {"actor": "model", "content": [{"kind": "text", "text": "hello Bedrock"}], "kind": "message"}
  ],
  "provider": {},
  "route": {},
  "service": {"attempted": "standard", "fallback_index": 0, "requested": "standard"},
  "status": "completed",
  "usage": {"cache_read_tokens": 0, "cache_write_tokens": 0, "input_tokens": 8, "output_tokens": 5, "reasoning_tokens": 0}
}
