{
  "api_version": "llm.temporal/v1",
  "operation_key": "minimal-1",
  "status": "completed",
  "output": [{"kind": "message", "actor": "model", "content": [{"kind": "text", "text": "The invoice is within policy."}]}],
  "route": {},
  "service": {"requested": "standard", "attempted": "standard", "fallback_index": 0},
  "usage": {"input_tokens": 10, "output_tokens": 7, "reasoning_tokens": 0, "cache_read_tokens": 0, "cache_write_tokens": 0},
  "cost": {"currency": "USD", "reserved_microusd": 100, "actual_microusd": 80, "method": "catalog_usage", "catalog_version": "prices-test"},
  "provider": {},
  "diagnostics": []
}
