{
  "api_version": "llm.temporal/v1",
  "cost": {"actual_microusd": 0, "catalog_version": "", "currency": "", "method": "", "reserved_microusd": 0},
  "diagnostics": [],
  "operation_key": "fixture-azure-response",
  "output": [
    {"actor": "model", "content": [{"kind": "text", "text": "azure hello"}], "kind": "message"},
    {"arguments": {"q": "azure"}, "id": "azure-call-1", "kind": "tool_call", "name": "lookup"},
    {"endpoint_family": "responses", "kind": "provider_state", "media_type": "application/vnd.openai.reasoning+json", "opaque": "ewogICAgICAiaWQiOiAiYXp1cmUtcmVhc29uLTEiLAogICAgICAidHlwZSI6ICJyZWFzb25pbmciLAogICAgICAic3RhdHVzIjogImNvbXBsZXRlZCIsCiAgICAgICJzdW1tYXJ5IjogW3sidHlwZSI6ICJzdW1tYXJ5X3RleHQiLCAidGV4dCI6ICJhenVyZSBicmllZiJ9XSwKICAgICAgImNvbnRlbnQiOiBbXSwKICAgICAgImVuY3J5cHRlZF9jb250ZW50IjogbnVsbAogICAgfQ==", "provider": "openai"}
  ],
  "provider": {"finish_reason": "completed", "raw": {"output_item_ids": ["azure-msg-1", "azure-fc-1", "azure-reason-1"]}, "request_id": "req-azure-fixture", "response_id": "azure-resp-1"},
  "route": {"api_family": "openai_responses", "endpoint_id": "azure-fixture", "requested_model": "azure-responses/fixture", "resolved_model": "azure-responses/fixture"},
  "service": {"actual": "priority", "attempted": "priority", "fallback_index": 0, "provider_value": "priority", "requested": "priority"},
  "status": "tool_calls",
  "usage": {"cache_read_tokens": 4, "cache_write_tokens": 1, "input_tokens": 12, "output_tokens": 9, "provider_raw": {"total_tokens": 21}, "reasoning_tokens": 3}
}
